{
  "version": 1,
  "libraryName": "政治理论与常识复盘资料库",
  "exportedAt": "2026-08-18T17:17:37.678Z",
  "questions": [
    {
      "id": "2027-国考-第30季-政治理论-01",
      "season": "2027 国考第30季",
      "subject": "政治理论",
      "number": 1,
      "stem": "某村在乡村振兴工作中，针对本地山地多、耕地少、特色中药材资源丰富的实际，组织村民搭建中药材种植基地，邀请农业专家指导进行标准化种植，同时搭建线上线下销售渠道，推动中药材产业提质增效，带动村民增收致富。但相邻某村无视自身资源禀赋，盲目跟风建设大型中药材种植基地，因缺乏技术支撑、销路不畅，造成项目亏损。关于其中蕴含的马克思主义哲学原理，下列说法错误的是：",
      "options": [
        {
          "key": "A",
          "text": "具体问题具体分析是正确解决矛盾的关键"
        },
        {
          "key": "B",
          "text": "正确发挥主观能动性必须以尊重客观规律为前提"
        },
        {
          "key": "C",
          "text": "认识对实践具有反作用，正确的认识能促进实践发展"
        },
        {
          "key": "D",
          "text": "矛盾的普遍性寓于特殊性之中，特殊性离不开普遍性"
        }
      ],
      "answer": "D",
      "answerStatus": "verified",
      "review": {
        "summary": "材料直接体现具体问题具体分析、尊重客观规律和认识对实践的反作用。",
        "analysis": "前一村立足资源禀赋并接受专业指导，体现具体问题具体分析和按规律办事；正确认识促进产业实践。D 本身是哲学命题，但不是两村对比材料所直接体现的原理。",
        "pitfalls": [
          "题目问的是材料蕴含，而不只是判断表述本身是否正确。"
        ],
        "memoryCue": "先看材料对应，再判断哲学表述。"
      },
      "tags": [
        "马克思主义哲学",
        "矛盾分析法"
      ],
      "difficulty": "easy",
      "match": {
        "status": "verified",
        "confidence": 0.99,
        "evidence": [
          "原题与复盘均以第1题标号，题目顺序和知识点主题一致。"
        ]
      },
      "sourceRefs": [
        {
          "file": "2027年国考第三十季行测模考大赛（行政执法类）.pdf",
          "locator": "第2页，第1题",
          "asset": "assets/sources/exam-2.jpg",
          "crop": {
            "focusY": 18,
            "label": "原题单题聚焦"
          }
        },
        {
          "file": "27国考行测模考第30季政治理论复盘.pdf",
          "locator": "第1页，第1题知识点",
          "asset": "assets/sources/politics-1.jpg",
          "crop": {
            "focusY": 13,
            "label": "政治理论复盘单题聚焦"
          }
        }
      ],
      "mastery": "new",
      "reviewState": {
        "step": 0,
        "nextReviewAt": null,
        "steps": {
          "again": 0,
          "fuzzy": 0,
          "know": 0
        },
        "history": []
      },
      "note": ""
    },
    {
      "id": "2027-国考-第30季-政治理论-02",
      "season": "2027 国考第30季",
      "subject": "政治理论",
      "number": 2,
      "stem": "马克思主义之所以能在中国落地生根、开花结果，根本在于中国共产党始终坚持解放思想、实事求是、与时俱进、求真务实，并非简单套用马克思主义经典作家设想的模板，而是勇于结合新的实践不断推进理论创新，推动马克思主义中国化实现飞跃。这一论述未体现的马克思主义哲学观点是：",
      "options": [
        {
          "key": "A",
          "text": "实践作为检验真理的标准具有不确定性"
        },
        {
          "key": "B",
          "text": "认识过程是反映和创造的统一"
        },
        {
          "key": "C",
          "text": "人们对客体的认识需要经历反复的过程"
        },
        {
          "key": "D",
          "text": "实践需接受理论检验并完善新的理论"
        }
      ],
      "answer": "D",
      "answerStatus": "verified",
      "review": {
        "summary": "理论要接受实践检验，而不是实践接受理论检验。",
        "analysis": "实践标准同时具有确定性与不确定性；认识是反映与创造的统一，并会在实践中反复发展。选项 D 倒置了理论与实践的检验关系。",
        "pitfalls": [
          "固定表述是“实践检验理论”，不能反向表述。"
        ],
        "memoryCue": "实践是检验认识真理性的唯一标准。"
      },
      "tags": [
        "马克思主义哲学",
        "实践与认识"
      ],
      "difficulty": "easy",
      "match": {
        "status": "verified",
        "confidence": 0.99,
        "evidence": [
          "原题与复盘均以第2题标号，题目顺序和知识点主题一致。"
        ]
      },
      "sourceRefs": [
        {
          "file": "2027年国考第三十季行测模考大赛（行政执法类）.pdf",
          "locator": "第2页，第2题",
          "asset": "assets/sources/exam-2.jpg",
          "crop": {
            "focusY": 34,
            "label": "原题单题聚焦"
          }
        },
        {
          "file": "27国考行测模考第30季政治理论复盘.pdf",
          "locator": "第1页，第2题知识点",
          "asset": "assets/sources/politics-1.jpg",
          "crop": {
            "focusY": 24,
            "label": "政治理论复盘单题聚焦"
          }
        }
      ],
      "mastery": "new",
      "reviewState": {
        "step": 0,
        "nextReviewAt": null,
        "steps": {
          "again": 0,
          "fuzzy": 0,
          "know": 0
        },
        "history": []
      },
      "note": ""
    },
    {
      "id": "2027-国考-第30季-政治理论-03",
      "season": "2027 国考第30季",
      "subject": "政治理论",
      "number": 3,
      "stem": "关于构建公正合理的全球人工智能治理体系，下列说法正确的有：\n①坚持开放共赢，驱动创新发展，鼓励开源开放、合作共享\n②强化风险意识，确保安全可控，高度重视人工智能引发的内生和衍生风险\n③鼓励包容并蓄，促进文明互鉴，用全人类共同价值塑造人工智能价值观\n④倡导和衷共济，完善全球治理，践行真正的多边主义",
      "options": [
        {
          "key": "A",
          "text": "1项"
        },
        {
          "key": "B",
          "text": "2项"
        },
        {
          "key": "C",
          "text": "3项"
        },
        {
          "key": "D",
          "text": "4项"
        }
      ],
      "answer": "D",
      "answerStatus": "verified",
      "review": {
        "summary": "四项均属于全球人工智能治理体系的重要原则。",
        "analysis": "治理体系强调开放共赢、风险意识、文明互鉴和多边主义；人工智能价值观应以和平、发展、公平、正义、民主、自由的全人类共同价值塑造。",
        "pitfalls": [
          "不要把“全人类共同价值”误判为西方所谓普世价值。"
        ],
        "memoryCue": "开放、安全、包容、多边。"
      },
      "tags": [
        "时政",
        "人工智能治理"
      ],
      "difficulty": "medium",
      "match": {
        "status": "verified",
        "confidence": 0.99,
        "evidence": [
          "原题与复盘均以第3题标号，题目顺序和知识点主题一致。"
        ]
      },
      "sourceRefs": [
        {
          "file": "2027年国考第三十季行测模考大赛（行政执法类）.pdf",
          "locator": "第2页，第3题",
          "asset": "assets/sources/exam-2.jpg",
          "crop": {
            "focusY": 50,
            "label": "原题单题聚焦"
          }
        },
        {
          "file": "27国考行测模考第30季政治理论复盘.pdf",
          "locator": "第1页，第3题知识点",
          "asset": "assets/sources/politics-1.jpg",
          "crop": {
            "focusY": 34,
            "label": "政治理论复盘单题聚焦"
          }
        }
      ],
      "mastery": "new",
      "reviewState": {
        "step": 0,
        "nextReviewAt": null,
        "steps": {
          "again": 0,
          "fuzzy": 0,
          "know": 0
        },
        "history": []
      },
      "note": ""
    },
    {
      "id": "2027-国考-第30季-政治理论-04",
      "season": "2027 国考第30季",
      "subject": "政治理论",
      "number": 4,
      "stem": "关于树立和践行正确政绩观，下列说法正确的有：\n①检查思想和行动是否偏离远大理想、背离全心全意为人民服务根本宗旨\n②政绩既体现在即期见效的潜绩上，也体现在打基础、利长远的显绩上\n③高质量发展是全面建设社会主义现代化国家的首要任务，应成为领导干部政绩观的重要内容\n④完善考评体系，积极促成“数字出官、官出数字”的良性循环",
      "options": [
        {
          "key": "A",
          "text": "1项"
        },
        {
          "key": "B",
          "text": "2项"
        },
        {
          "key": "C",
          "text": "3项"
        },
        {
          "key": "D",
          "text": "4项"
        }
      ],
      "answer": "B",
      "answerStatus": "verified",
      "review": {
        "summary": "①③正确，正确政绩观以人民为中心并服务高质量发展。",
        "analysis": "显绩是当下可见的工作，潜绩是打基础、利长远的工作，②将二者倒置；“数字出官、官出数字”是应防止的恶性循环，④错误。",
        "pitfalls": [
          "显绩与潜绩经常被互换设置干扰。",
          "“数字出官、官出数字”不是正向表述。"
        ],
        "memoryCue": "显绩看当下，潜绩利长远。"
      },
      "tags": [
        "政绩观",
        "服务人民"
      ],
      "difficulty": "easy",
      "match": {
        "status": "verified",
        "confidence": 0.99,
        "evidence": [
          "原题与复盘均以第4题标号，题目顺序和知识点主题一致。"
        ]
      },
      "sourceRefs": [
        {
          "file": "2027年国考第三十季行测模考大赛（行政执法类）.pdf",
          "locator": "第2页，第4题",
          "asset": "assets/sources/exam-2.jpg",
          "crop": {
            "focusY": 66,
            "label": "原题单题聚焦"
          }
        },
        {
          "file": "27国考行测模考第30季政治理论复盘.pdf",
          "locator": "第1页，第4题知识点",
          "asset": "assets/sources/politics-1.jpg",
          "crop": {
            "focusY": 45,
            "label": "政治理论复盘单题聚焦"
          }
        }
      ],
      "mastery": "new",
      "reviewState": {
        "step": 0,
        "nextReviewAt": null,
        "steps": {
          "again": 0,
          "fuzzy": 0,
          "know": 0
        },
        "history": []
      },
      "note": ""
    },
    {
      "id": "2027-国考-第30季-政治理论-05",
      "season": "2027 国考第30季",
      "subject": "政治理论",
      "number": 5,
      "stem": "关于中国共产党105年不懈奋斗的相关表述，正确的有：\n①展示了马克思主义的强大生命力，极大丰富和发展了马克思主义\n②从根本上改变了中国人民的前途命运，建立人民当家作主的新中国\n③深刻影响了世界历史进程，我们党始终站在历史正确一边\n④我们党已经发展成为具有重大全球影响力的世界第二大执政党",
      "options": [
        {
          "key": "A",
          "text": "1项"
        },
        {
          "key": "B",
          "text": "2项"
        },
        {
          "key": "C",
          "text": "3项"
        },
        {
          "key": "D",
          "text": "4项"
        }
      ],
      "answer": "C",
      "answerStatus": "verified",
      "review": {
        "summary": "①②③正确，中国共产党是世界第一大政党。",
        "analysis": "百余年奋斗改变中国人民命运、丰富发展马克思主义并影响世界历史进程。④把中国共产党的世界第一大政党地位错写为第二大。",
        "pitfalls": [
          "人民性是党的根本属性，不只是一般重要特征。"
        ],
        "memoryCue": "中国共产党是世界第一大政党。"
      },
      "tags": [
        "党史",
        "政党地位"
      ],
      "difficulty": "hard",
      "match": {
        "status": "verified",
        "confidence": 0.99,
        "evidence": [
          "原题与复盘均以第5题标号，题目顺序和知识点主题一致。"
        ]
      },
      "sourceRefs": [
        {
          "file": "2027年国考第三十季行测模考大赛（行政执法类）.pdf",
          "locator": "第2页，第5题",
          "asset": "assets/sources/exam-2.jpg",
          "crop": {
            "focusY": 82,
            "label": "原题单题聚焦"
          }
        },
        {
          "file": "27国考行测模考第30季政治理论复盘.pdf",
          "locator": "第1页，第5题知识点",
          "asset": "assets/sources/politics-1.jpg",
          "crop": {
            "focusY": 55,
            "label": "政治理论复盘单题聚焦"
          }
        }
      ],
      "mastery": "new",
      "reviewState": {
        "step": 0,
        "nextReviewAt": null,
        "steps": {
          "again": 0,
          "fuzzy": 0,
          "know": 0
        },
        "history": []
      },
      "note": ""
    },
    {
      "id": "2027-国考-第30季-政治理论-06",
      "season": "2027 国考第30季",
      "subject": "政治理论",
      "number": 6,